{
  "type": "Page",
  "hideBorders": false,
  "title": "page example 3",
  "views": [
    {
      "path": "/views/text3.json",
      "geometry": {
      "kind": "Relative",
      "x": 8,
      "y": 4,
      "w": 4,
      "h": 16
      },
      "windowState": "Normalized"
    },
	{
	  "path": "/views/plot1.json",
	  "geometry": {
		"kind": "Relative",
		"x": 0,
		"y": 2,
		"w": 4,
		"h": 16
	  },
	  "windowState": "Normalized"
	},
  {
	  "path": "/views/plot3.json",
	  "geometry": {
		"kind": "Relative",
		"x": 4,
		"y": 6,
		"w": 4,
		"h": 16
	  },
	  "windowState": "Normalized"
	}
  ]
}
