{
  "type": "Page",
  "hideBorders": false,
  "title": "page example 3",
  "views": [
	{
	  "path": "/views/plot.exe1.workspace.json",
	  "geometry": {
		"kind": "Relative",
		"x": 0,
		"y": 0,
		"w": 12,
		"h": 7
	  },
	  "windowState": "Normalized"
	},
  {
	  "path": "/views/plot.exe2.workspace.json",
	  "geometry": {
		"kind": "Relative",
		"x": 0,
		"y": 0,
		"w": 12,
		"h": 7
	  },
	  "windowState": "Normalized"
	}
  ]
}
