{
  "type": "Page",
  "hideBorders": false,
  "title": "page Sup/Sup workspace",
  "views": [
    {
      "path": "/views/plotviewSupsup_Test10.json",
      "geometry": {
        "kind": "Relative",
        "x": 4,
        "y": 0,
        "w": 4,
        "h": 14	
      },
      "windowState": "Normalized"
    },
{
      "path": "/views/plotviewSupsup.json",
      "geometry": {
        "kind": "Relative",
        "x": 0,
        "y": 0,
        "w": 4,
        "h": 14	
      },
      "windowState": "Normalized"
    },
    {
      "path": "/views/textviewSupsup.json",
      "geometry": {
        "kind": "Relative",
        "x": 8,
        "y": 0,
        "w": 4,
        "h": 14	
      },
      "windowState": "Normalized"
    }
  ]
}
