{
  "type": "Page",
  "hideBorders": false,
  "title": "showcase page",
  "views": [
    {
      "oId": "/views/plot1.view.json",
      "geometry": {
        "kind": "Relative",
        "x": 0,
        "y": 0,
        "w": 6,
        "h": 8
      },
      "windowState": "Normalized"
    },
    {
      "oId": "/views/text1.view.json",
      "geometry": {
        "kind": "Relative",
        "x": 0,
        "y": 9,
        "w": 4,
        "h": 8
      },
      "windowState": "Normalized"
    }
  ]
}
