{
  "type": "Page",
  "hideBorders": false,
  "title": "Page example",
  "views": [
    {
      "oId": "/VIMA_Demos/PV/PV.example.json",
      "geometry": {
        "kind": "Relative",
        "x": 5,
        "y": 5,
        "w": 45,
        "h": 50
      },
      "windowState": "Normalized"
    },
    {
      "path": "PV/PV.example.json",
      "geometry": {
        "kind": "Relative",
        "x": 50,
        "y": 5,
        "w": 45,
        "h": 50
      },
      "windowState": "Normalized"
    }
  ]
}
