{
  "type": "Page",
  "hideBorders": false,
  "title": "page Test workspace",
  "views": [
    {
      "path": "/views/textviewTest.json",
      "geometry": {
      "kind": "Relative",
      "x": 0,
      "y": 0,
      "w": 6,
      "h": 14
      },
      "windowState": "Normalized"
    },
    {
      "path": "/views/plotviewTest.json",
      "geometry": {
        "kind": "Relative",
        "x": 6,
        "y": 0,
        "w": 6,
        "h": 14
      },
      "windowState": "Normalized"
    }
  ]
}
